[
  {
    "id": "frus-1914supp-d423",
    "series": "Foreign Relations of the United States",
    "volume": "frus1914Supp",
    "document_number": "423",
    "title": null,
    "date": null,
    "participants": [],
    "country_ids": [
      "united-states"
    ],
    "mineral_ids": [
      "copper"
    ],
    "policy_themes": [
      "wartime shipping"
    ],
    "source_note": null,
    "stable_url": "https://history.state.gov/historicaldocuments/frus1914Supp/d423",
    "volume_context": "Shipments of Copper",
    "volume_year_start": 1914,
    "volume_year_end": 1914,
    "contextual_summary": null,
    "statistic_ids": [],
    "agreement_ids": [
      "copper-shipment-correspondence-1914"
    ],
    "law_ids": [],
    "nara_query_ids": [],
    "outcome": null,
    "metadata_status": "subject-index-lead",
    "source_ids": [
      "frus-history-at-state",
      "frus-subject-index"
    ]
  },
  {
    "id": "frus-1914supp-d427",
    "series": "Foreign Relations of the United States",
    "volume": "frus1914Supp",
    "document_number": "427",
    "title": null,
    "date": null,
    "participants": [],
    "country_ids": [
      "united-states"
    ],
    "mineral_ids": [
      "copper"
    ],
    "policy_themes": [
      "wartime shipping"
    ],
    "source_note": null,
    "stable_url": "https://history.state.gov/historicaldocuments/frus1914Supp/d427",
    "volume_context": "Shipments of Copper",
    "volume_year_start": 1914,
    "volume_year_end": 1914,
    "contextual_summary": null,
    "statistic_ids": [],
    "agreement_ids": [
      "copper-shipment-correspondence-1914"
    ],
    "law_ids": [],
    "nara_query_ids": [],
    "outcome": null,
    "metadata_status": "subject-index-lead",
    "source_ids": [
      "frus-history-at-state",
      "frus-subject-index"
    ]
  },
  {
    "id": "frus-1925v02-d327",
    "series": "Foreign Relations of the United States",
    "volume": "frus1925v02",
    "document_number": "327",
    "title": null,
    "date": null,
    "participants": [],
    "country_ids": [],
    "mineral_ids": [],
    "policy_themes": [
      "concessions",
      "private finance"
    ],
    "source_note": null,
    "stable_url": "https://history.state.gov/historicaldocuments/frus1925v02/d327",
    "volume_context": "Negotiations concerning the Firestone rubber concession and Finance Corporation of America loan",
    "volume_year_start": 1925,
    "volume_year_end": 1925,
    "contextual_summary": null,
    "statistic_ids": [],
    "agreement_ids": [
      "firestone-rubber-concession-negotiations-1925"
    ],
    "law_ids": [],
    "nara_query_ids": [],
    "outcome": null,
    "metadata_status": "subject-index-lead",
    "source_ids": [
      "frus-history-at-state",
      "frus-subject-index"
    ]
  },
  {
    "id": "frus-1925v02-d344",
    "series": "Foreign Relations of the United States",
    "volume": "frus1925v02",
    "document_number": "344",
    "title": null,
    "date": null,
    "participants": [],
    "country_ids": [],
    "mineral_ids": [],
    "policy_themes": [
      "concessions",
      "private finance"
    ],
    "source_note": null,
    "stable_url": "https://history.state.gov/historicaldocuments/frus1925v02/d344",
    "volume_context": "Negotiations concerning the Firestone rubber concession and Finance Corporation of America loan",
    "volume_year_start": 1925,
    "volume_year_end": 1925,
    "contextual_summary": null,
    "statistic_ids": [],
    "agreement_ids": [
      "firestone-rubber-concession-negotiations-1925"
    ],
    "law_ids": [],
    "nara_query_ids": [],
    "outcome": null,
    "metadata_status": "subject-index-lead",
    "source_ids": [
      "frus-history-at-state",
      "frus-subject-index"
    ]
  },
  {
    "id": "frus-1939v01-d934",
    "series": "Foreign Relations of the United States",
    "volume": "frus1939v01",
    "document_number": "934",
    "title": null,
    "date": null,
    "participants": [],
    "country_ids": [
      "united-states"
    ],
    "mineral_ids": [],
    "policy_themes": [
      "stockpile planning"
    ],
    "source_note": null,
    "stable_url": "https://history.state.gov/historicaldocuments/frus1939v01/d934",
    "volume_context": "I. Formulation of plans to acquire adequate stockpiles of strategic raw materials",
    "volume_year_start": 1939,
    "volume_year_end": 1939,
    "contextual_summary": null,
    "statistic_ids": [],
    "agreement_ids": [
      "strategic-stockpile-planning-1939"
    ],
    "law_ids": [],
    "nara_query_ids": [],
    "outcome": null,
    "metadata_status": "subject-index-lead",
    "source_ids": [
      "frus-history-at-state",
      "frus-subject-index"
    ]
  },
  {
    "id": "frus-1939v01-d939",
    "series": "Foreign Relations of the United States",
    "volume": "frus1939v01",
    "document_number": "939",
    "title": null,
    "date": null,
    "participants": [],
    "country_ids": [
      "united-states"
    ],
    "mineral_ids": [],
    "policy_themes": [
      "stockpile planning"
    ],
    "source_note": null,
    "stable_url": "https://history.state.gov/historicaldocuments/frus1939v01/d939",
    "volume_context": "I. Formulation of plans to acquire adequate stockpiles of strategic raw materials",
    "volume_year_start": 1939,
    "volume_year_end": 1939,
    "contextual_summary": null,
    "statistic_ids": [],
    "agreement_ids": [
      "strategic-stockpile-planning-1939"
    ],
    "law_ids": [],
    "nara_query_ids": [],
    "outcome": null,
    "metadata_status": "subject-index-lead",
    "source_ids": [
      "frus-history-at-state",
      "frus-subject-index"
    ]
  },
  {
    "id": "frus-1941v02-d805",
    "series": "Foreign Relations of the United States",
    "volume": "frus1941v02",
    "document_number": "805",
    "title": null,
    "date": null,
    "participants": [],
    "country_ids": [
      "surinam"
    ],
    "mineral_ids": [
      "bauxite",
      "aluminum"
    ],
    "policy_themes": [
      "mine protection"
    ],
    "source_note": null,
    "stable_url": "https://history.state.gov/historicaldocuments/frus1941v02/d805",
    "volume_context": "Arrangements for sending American forces to Surinam to assist in protection of bauxite mines",
    "volume_year_start": 1941,
    "volume_year_end": 1941,
    "contextual_summary": null,
    "statistic_ids": [],
    "agreement_ids": [
      "surinam-bauxite-protection-1941"
    ],
    "law_ids": [],
    "nara_query_ids": [],
    "outcome": null,
    "metadata_status": "subject-index-lead",
    "source_ids": [
      "frus-history-at-state",
      "frus-subject-index"
    ]
  },
  {
    "id": "frus-1941v02-d821",
    "series": "Foreign Relations of the United States",
    "volume": "frus1941v02",
    "document_number": "821",
    "title": null,
    "date": null,
    "participants": [],
    "country_ids": [
      "surinam"
    ],
    "mineral_ids": [
      "bauxite",
      "aluminum"
    ],
    "policy_themes": [
      "mine protection"
    ],
    "source_note": null,
    "stable_url": "https://history.state.gov/historicaldocuments/frus1941v02/d821",
    "volume_context": "Arrangements for sending American forces to Surinam to assist in protection of bauxite mines",
    "volume_year_start": 1941,
    "volume_year_end": 1941,
    "contextual_summary": null,
    "statistic_ids": [],
    "agreement_ids": [
      "surinam-bauxite-protection-1941"
    ],
    "law_ids": [],
    "nara_query_ids": [],
    "outcome": null,
    "metadata_status": "subject-index-lead",
    "source_ids": [
      "frus-history-at-state",
      "frus-subject-index"
    ]
  },
  {
    "id": "frus-1941v03-d1006",
    "series": "Foreign Relations of the United States",
    "volume": "frus1941v03",
    "document_number": "1006",
    "title": null,
    "date": null,
    "participants": [],
    "country_ids": [
      "turkey"
    ],
    "mineral_ids": [
      "chromium"
    ],
    "policy_themes": [
      "allied purchasing",
      "denial"
    ],
    "source_note": null,
    "stable_url": "https://history.state.gov/historicaldocuments/frus1941v03/d1006",
    "volume_context": "Efforts by the American and British Governments to acquire Turkish chrome and to prevent its sale by Turkey to Germany",
    "volume_year_start": 1941,
    "volume_year_end": 1941,
    "contextual_summary": null,
    "statistic_ids": [],
    "agreement_ids": [
      "turkish-chrome-negotiations-1941"
    ],
    "law_ids": [],
    "nara_query_ids": [],
    "outcome": null,
    "metadata_status": "subject-index-lead",
    "source_ids": [
      "frus-history-at-state",
      "frus-subject-index"
    ]
  },
  {
    "id": "frus-1941v03-d1038",
    "series": "Foreign Relations of the United States",
    "volume": "frus1941v03",
    "document_number": "1038",
    "title": null,
    "date": null,
    "participants": [],
    "country_ids": [
      "turkey"
    ],
    "mineral_ids": [
      "chromium"
    ],
    "policy_themes": [
      "allied purchasing",
      "denial"
    ],
    "source_note": null,
    "stable_url": "https://history.state.gov/historicaldocuments/frus1941v03/d1038",
    "volume_context": "Efforts by the American and British Governments to acquire Turkish chrome and to prevent its sale by Turkey to Germany",
    "volume_year_start": 1941,
    "volume_year_end": 1941,
    "contextual_summary": null,
    "statistic_ids": [],
    "agreement_ids": [
      "turkish-chrome-negotiations-1941"
    ],
    "law_ids": [],
    "nara_query_ids": [],
    "outcome": null,
    "metadata_status": "subject-index-lead",
    "source_ids": [
      "frus-history-at-state",
      "frus-subject-index"
    ]
  },
  {
    "id": "frus-1942v02-d3",
    "series": "Foreign Relations of the United States",
    "volume": "frus1942v02",
    "document_number": "3",
    "title": null,
    "date": null,
    "participants": [],
    "country_ids": [
      "belgian-congo"
    ],
    "mineral_ids": [
      "cobalt",
      "copper",
      "tin"
    ],
    "policy_themes": [